{
  "version": 1,
  "specimenId": "parthenon",
  "lane": "ontology",
  "tasks": [
    {
      "id": "PAR-ON-001",
      "title": "Audit concept coverage for this building",
      "description": "Deliver and verify this stage of the ontology workflow.",
      "status": "done",
      "priority": 1,
      "dependsOn": [
        "PAR-SP-004"
      ],
      "acceptanceCriteria": [
        "List supported component types and missing concepts without presuming their presence",
        "Distinguish known vocabulary from building-specific evidence"
      ],
      "outputs": [
        "specimens/parthenon/ontology/gaps.json"
      ],
      "evidence": [
        {
          "path": "specimens/parthenon/ontology/gaps.json",
          "note": "Curated source-aware semantic data with documented reconstruction limitations."
        }
      ],
      "review": {
        "status": "passed",
        "notes": "Type and instance identifiers, sources, and source-backed aggregate counts checked."
      },
      "blockedReason": null
    },
    {
      "id": "PAR-ON-002",
      "title": "Research missing architectural concept types",
      "description": "Deliver and verify this stage of the ontology workflow.",
      "status": "done",
      "priority": 2,
      "dependsOn": [
        "PAR-ON-001",
        "PAR-SP-003"
      ],
      "acceptanceCriteria": [
        "Add sourced definitions, aliases, purposes, positions, materials and recognition cues where needed",
        "Avoid creating building-specific types when the term is more general"
      ],
      "outputs": [
        "ontology/components.json"
      ],
      "evidence": [
        {
          "path": "ontology/components.json",
          "note": "Curated source-aware semantic data with documented reconstruction limitations."
        }
      ],
      "review": {
        "status": "passed",
        "notes": "Type and instance identifiers, sources, and source-backed aggregate counts checked."
      },
      "blockedReason": null
    },
    {
      "id": "PAR-ON-003",
      "title": "Formalize component hierarchy and relation vocabulary",
      "description": "Deliver and verify this stage of the ontology workflow.",
      "status": "done",
      "priority": 3,
      "dependsOn": [
        "PAR-ON-001"
      ],
      "acceptanceCriteria": [
        "Define part-of, supports, adjacent-to, decorated-with and accessed-through as appropriate",
        "Document typed, directed, evidence-specific links rather than generic adjacency guesses"
      ],
      "outputs": [
        "specimens/parthenon/ontology/relations.json"
      ],
      "evidence": [
        {
          "path": "specimens/parthenon/ontology/relations.json",
          "note": "Curated source-aware semantic data with documented reconstruction limitations."
        }
      ],
      "review": {
        "status": "passed",
        "notes": "Type and instance identifiers, sources, and source-backed aggregate counts checked."
      },
      "blockedReason": null
    },
    {
      "id": "PAR-ON-004",
      "title": "Instantiate physical architectural elements",
      "description": "Deliver and verify this stage of the ontology workflow.",
      "status": "done",
      "priority": 4,
      "dependsOn": [
        "PAR-ON-002",
        "PAR-SP-007"
      ],
      "acceptanceCriteria": [
        "Assign stable specimen-specific IDs to evidenced parts and repeated instances",
        "Map every identified instance to a canonical architectural component type"
      ],
      "outputs": [
        "specimens/parthenon/ontology/instances.json"
      ],
      "evidence": [
        {
          "path": "specimens/parthenon/ontology/instances.json",
          "note": "Curated source-aware semantic data with documented reconstruction limitations."
        }
      ],
      "review": {
        "status": "passed",
        "notes": "Type and instance identifiers, sources, and source-backed aggregate counts checked."
      },
      "blockedReason": null
    },
    {
      "id": "PAR-ON-005",
      "title": "Map structural and spatial part relationships",
      "description": "Deliver and verify this stage of the ontology workflow.",
      "status": "done",
      "priority": 5,
      "dependsOn": [
        "PAR-ON-003",
        "PAR-ON-004"
      ],
      "acceptanceCriteria": [
        "Create component-to-component and component-to-space links with typed predicates",
        "Validate referenced IDs and mark interpretive relationships explicitly"
      ],
      "outputs": [
        "specimens/parthenon/ontology/instance-relations.json"
      ],
      "evidence": [
        {
          "path": "specimens/parthenon/ontology/instance-relations.json",
          "note": "Curated source-aware semantic data with documented reconstruction limitations."
        }
      ],
      "review": {
        "status": "passed",
        "notes": "Type and instance identifiers, sources, and source-backed aggregate counts checked."
      },
      "blockedReason": null
    },
    {
      "id": "PAR-ON-006",
      "title": "Attach spatial transforms and structural positions",
      "description": "Deliver and verify this stage of the ontology workflow.",
      "status": "done",
      "priority": 6,
      "dependsOn": [
        "PAR-ON-004",
        "PAR-SP-010"
      ],
      "acceptanceCriteria": [
        "Store coordinates, units, orientation and level for each positioned instance",
        "Trace transforms to measurements or label estimates and uncertainty"
      ],
      "outputs": [
        "specimens/parthenon/ontology/spatial.json"
      ],
      "evidence": [
        {
          "path": "specimens/parthenon/ontology/spatial.json",
          "note": "Curated source-aware semantic data with documented reconstruction limitations."
        }
      ],
      "review": {
        "status": "passed",
        "notes": "Type and instance identifiers, sources, and source-backed aggregate counts checked."
      },
      "blockedReason": null
    },
    {
      "id": "PAR-ON-007",
      "title": "Annotate materials and fabrication roles",
      "description": "Deliver and verify this stage of the ontology workflow.",
      "status": "done",
      "priority": 7,
      "dependsOn": [
        "PAR-ON-004",
        "PAR-SP-012"
      ],
      "acceptanceCriteria": [
        "Describe supported material families, finishes and construction roles per instance",
        "Clearly distinguish demonstrated ancient conditions from modern replacements"
      ],
      "outputs": [
        "specimens/parthenon/ontology/materials.json"
      ],
      "evidence": [
        {
          "path": "specimens/parthenon/ontology/materials.json",
          "note": "Curated source-aware semantic data with documented reconstruction limitations."
        }
      ],
      "review": {
        "status": "passed",
        "notes": "Type and instance identifiers, sources, and source-backed aggregate counts checked."
      },
      "blockedReason": null
    },
    {
      "id": "PAR-ON-008",
      "title": "Connect instances to historical phases",
      "description": "Deliver and verify this stage of the ontology workflow.",
      "status": "done",
      "priority": 8,
      "dependsOn": [
        "PAR-ON-004",
        "PAR-SP-005"
      ],
      "acceptanceCriteria": [
        "Record which building phases each instance belongs to",
        "Identify restored, missing and conjectural instances where documented"
      ],
      "outputs": [
        "specimens/parthenon/ontology/phases.json"
      ],
      "evidence": [
        {
          "path": "specimens/parthenon/ontology/phases.json",
          "note": "Curated source-aware semantic data with documented reconstruction limitations."
        }
      ],
      "review": {
        "status": "passed",
        "notes": "Type and instance identifiers, sources, and source-backed aggregate counts checked."
      },
      "blockedReason": null
    },
    {
      "id": "PAR-ON-009",
      "title": "Record evidence and confidence per instance",
      "description": "Deliver and verify this stage of the ontology workflow.",
      "status": "done",
      "priority": 9,
      "dependsOn": [
        "PAR-ON-005",
        "PAR-ON-006",
        "PAR-ON-008"
      ],
      "acceptanceCriteria": [
        "Trace significant attributes and instance claims to specific source identifiers",
        "Mark uncertain, conflicting and unknown elements rather than inserting defaults"
      ],
      "outputs": [
        "specimens/parthenon/ontology/evidence.json"
      ],
      "evidence": [
        {
          "path": "specimens/parthenon/ontology/evidence.json",
          "note": "Curated source-aware semantic data with documented reconstruction limitations."
        }
      ],
      "review": {
        "status": "passed",
        "notes": "Type and instance identifiers, sources, and source-backed aggregate counts checked."
      },
      "blockedReason": null
    },
    {
      "id": "PAR-ON-010",
      "title": "Define stable mesh-to-ontology mapping contract",
      "description": "Deliver and verify this stage of the ontology workflow.",
      "status": "done",
      "priority": 10,
      "dependsOn": [
        "PAR-ON-006",
        "PAR-ON-009"
      ],
      "acceptanceCriteria": [
        "Assign unique public mesh/instance IDs and canonical type references",
        "Define picking and grouping rules for repeated geometry and unmodeled elements"
      ],
      "outputs": [
        "specimens/parthenon/ontology/mesh-map.json"
      ],
      "evidence": [
        {
          "path": "specimens/parthenon/ontology/mesh-map.json",
          "note": "Curated source-aware semantic data with documented reconstruction limitations."
        }
      ],
      "review": {
        "status": "passed",
        "notes": "Type and instance identifiers, sources, and source-backed aggregate counts checked."
      },
      "blockedReason": null
    },
    {
      "id": "PAR-ON-011",